{
  "$schema": "https://json-schema.org/draft/2020-12/schema",
  "$id": "https://example.local/schemas/story-fingerprint-1.0.0.json",
  "title": "Story and Causal Fingerprint",
  "type": "object",
  "additionalProperties": false,
  "required": ["schema_family", "schema_version", "project_id", "story", "beat_signature", "causal"],
  "properties": {
    "$schema": {
      "type": "string"
    },
    "schema_family": {
      "const": "story-fingerprint"
    },
    "schema_version": {
      "type": "string",
      "pattern": "^[0-9]+\\.[0-9]+\\.[0-9]+$"
    },
    "project_id": {
      "type": "string",
      "pattern": "^PRJ-[0-9]{3,}$"
    },
    "story": {
      "type": "object",
      "minProperties": 1,
      "additionalProperties": {
        "type": ["string", "array"]
      }
    },
    "beat_signature": {
      "type": "array",
      "minItems": 1,
      "items": {
        "type": "string",
        "pattern": "^[A-Z][A-Z0-9_]*$"
      }
    },
    "causal": {
      "type": "object",
      "additionalProperties": false,
      "required": ["root_cause", "mechanism", "concealment", "discovery_path", "resolution"],
      "properties": {
        "root_cause": {
          "type": "string",
          "minLength": 1
        },
        "mechanism": {
          "type": "string",
          "minLength": 1
        },
        "concealment": {
          "type": "string",
          "minLength": 1
        },
        "discovery_path": {
          "type": "string",
          "minLength": 1
        },
        "resolution": {
          "type": "string",
          "minLength": 1
        }
      }
    }
  }
}
