{
  "$schema": "../../../STANDARD/schemas/story_fingerprint.schema.json",
  "schema_family": "story-fingerprint",
  "schema_version": "1.0.0",
  "project_id": "PRJ-000",
  "story": {},
  "beat_signature": [],
  "causal": {
    "root_cause": "",
    "mechanism": "",
    "concealment": "",
    "discovery_path": "",
    "resolution": ""
  }
}
