{
  "schema_family": "story-fingerprint",
  "schema_version": "1.0.0",
  "project_id": "PRJ-001",
  "story": {
    "mystery_type": "HOW",
    "architecture": "ARCH-03_DUAL_INQUIRY",
    "protagonist_role": "AUTHORITY",
    "primary_twist": "TW-10_RESOLUTION_CHANGES_INCIDENT",
    "timeline_style": "REAL_TIME",
    "incident_type": "NO_CRIME",
    "setting": "GUESTHOUSE",
    "culprit_structure": "NO_CULPRIT",
    "setting_logic": [
      "COASTAL_ISOLATION",
      "REPURPOSED_WEATHER_RELAY",
      "STORM_LOCKDOWN"
    ],
    "information_mechanism": [
      "DELAYED_VOICE_PACKET",
      "INDEPENDENT_SENSOR_PULSE",
      "ACOUSTIC_PIPE_SIGNAL"
    ],
    "relationship_engine": "DEPENDENCY",
    "pressure_engine": "COUNTDOWN",
    "dramatic_engine": "IDENTITY_CRISIS"
  },
  "beat_signature": [
    "HOOK",
    "DUAL_INQUIRY_LAUNCH",
    "WRONG_SEARCH",
    "DATA_CONTRADICTION",
    "MIDPOINT_REFRAME",
    "COUNTDOWN_DESCENT",
    "RESOLUTION",
    "AFTERMATH_IDENTITY_REFRAME"
  ],
  "causal": {
    "root_cause": "LIGHTNING_PHASE_DROP",
    "mechanism": "QUEUED_VOICE_REPLAY_AND_FIRE_DOOR_LOCK",
    "concealment": "DASHBOARD_TIMESTAMP_AND_BREAKWATER_TRACKS",
    "discovery_path": "RAIN_GAUGE_PULSE_AND_PIPE_TAPPING",
    "resolution": "CISTERN_HATCH_RESCUE"
  }
}
